Solution Name,Technologies,Description
Sustainable Urban Mobility Solutions,"electric vehicles, mobile apps for transportation sharing, infrastructure for cycling and walking","implementing sustainable urban mobility solutions, such as electric, shared transportation options and bike-sharing initiatives, can reduce the heat generated by vehicles, decrease water pollution from runoff, and promote community resilience."
Fire Weather Monitoring System,"satellite imaging, meteorological sensors, alert systems","a monitoring system that utilizes satellite data and ground-based weather stations to track conditions conducive to wildfires, providing alerts and recommendations to minimize the risks of wildfires in vulnerable regions."
Early Warning Systems,"satellite imagery, machine learning, communication networks","technology that monitors atmospheric conditions to provide good predictive capabilities for severe storms, which can alert communities in advance, enabling evacuation and preparedness actions."
Landslide Monitoring System,"ground-penetrating radar, satellite imagery, data analytics, real-time monitoring systems","this system employs ground-penetrating radar and satellite imaging to monitor slopes and other geological factors in real time, providing early warnings of potential landslides due to heavy precipitation."
Flood Risk Management Applications,"geographic information systems (gis), hydraulic modeling, simulation software",flood risk management applications utilize gis and simulation models to assess flood risks and guide urban planning. these applications help cities develop flood defense measures and prepare emergency response plans for populations living in flood-prone areas.
Predictive Health Risk Management System,"data analytics, machine learning, mobile health applications","this system collects and analyzes health data to predict outbreaks of heat-related illnesses during extreme heat events, enabling healthcare providers to allocate resources efficiently and engage in proactive health care interventions."
Vertical Resilience Project,"building energy management systems, green building materials, smart sensor technology","the vertical resilience project aims to implement deep retrofits in high-rise apartment buildings to improve their resilience against extreme heat and flooding, thereby ensuring safer living conditions for the large populations residing in these edifices."
Predictive Fire Risk Management System,"machine learning, satellite imagery, data analytics, ai algorithms","this system leverages machine learning algorithms to analyze weather patterns and vegetation data to predict the risk of wildfires, providing early warnings and resource allocation recommendations."
**Wildfire Risk Mapping and Mitigation Technology**,"satellite imaging, predictive analytics, gis, drone technology",this utilizes satellite imagery and predictive analytics to identify areas at high risk of wildfires and develop mitigation plans including prescribed burns and buffer zones to reduce fire spread.
Flood Resilience Infrastructure,"engineering design software, environmental modeling tools, biodiversity monitoring systems.",implementation of physical barriers (like seawalls) and nature-based solutions (like wetlands restoration) designed to buffer against coastal flooding due to rising sea levels.
Integrated Health Surveillance System,"health data analytics, environmental monitoring, predictive modeling",this system combines health data with environmental monitoring to track and predict outbreaks of infectious diseases influenced by climate-related factors such as extreme weather or rising temperatures. it enhances public health preparedness and response efforts.
Community Resilience Hubs,"renewable energy systems, communication networks, resource management tools","community resilience hubs are physical spaces equipped with resources and technology to support local communities before, during, and after climate shocks. these hubs can provide services like food distribution, emergency communication, and cooling or heating stations during severe weather."
Community Adaptation Planning Tools,"geographic information systems (gis), participatory planning software, data visualization tools",community adaptation planning tools assist local governments and communities in assessing vulnerabilities and developing tailored adaptation strategies that prioritize the needs of the most affected populations. these tools promote engagement in the decision-making process and help allocate resources effectively.
Digital Community Networks,"social media platforms, mobile networking applications, cloud computing","digital community networks leverage technology to connect residents, especially those from vulnerable populations, with resources and each other. these platforms can facilitate communication during emergencies, provide information on shelters and services, and foster community solidarity."
Adaptive Water Management Systems,"data analytics, iot sensors, water quality monitoring systems",adaptive water management systems leverage data analytics for efficient water distribution and conservation strategies. they are especially critical for vulnerable communities facing water scarcity due to drought or increased demand from climate impacts.
Digital Platforms for Community Engagement,"online survey tools, social media platforms, community engagement software, mobile apps","digital engagement platforms can allow vulnerable populations to voice their concerns and ideas about resilience strategies. this technology enables real-time feedback and can gather data on community needs, ensuring all voices are represented in climate resilience efforts."
Video Campaigns for Awareness,"video editing software, social media channels, film distribution platforms",the creation of video campaigns that showcase diverse community experiences with climate impacts builds awareness and promotes dialogue around climate adaptation strategies at a local level.
Youth Leadership and Media Production,"digital media tools, social media platforms, online training resources","the village bloggurls program empowers young women to share their stories and advocate for resilience strategies in their communities, leveraging digital media to raise awareness and promote solidarity."
Climate adaptation monitoring systems,"iot sensors, big data analytics, cloud computing","implementation of monitoring systems that track local climate variables, water consumption patterns, and drought indicators to provide decision-makers with data needed for water management strategies and resource allocation."
Youth Empowerment and Training Platforms,"e-learning portals, social networking, mobile applications, virtual reality (for training simulations)","online platforms aimed at empowering youth in stigmatized neighborhoods through training in leadership, resilience, and response to emergencies, fostering community cohesion and resilience against extreme weather events and social violence."
Global Resilience Movement Framework,"online collaborative platforms, knowledge management systems, cloud-based data sharing tools","the global resilience movement provides a framework and community for cities to share best practices and technologies for addressing a wide array of climate challenges, facilitating knowledge exchange and innovation in resilience building."
Emergency Response Drones,"drone technology, aerial imaging, real-time data transmission, sensor technology",drones equipped with cameras and sensors can be deployed to assess damage and aid in search and rescue operations during and after severe weather events. they can provide real-time aerial imagery and vital data for emergency services.
Urban Agricultural Innovations,"hydroponics, automated irrigation systems, led lighting, climate control systems","utilizing vertical farming and hydroponic technologies, this solution enables urban areas to produce food locally, reducing reliance on external food supplies that may be disrupted by climate events. it helps build resilience against food supply chain disruptions."
Community Health Employment and Education Initiative,"mobile applications, telehealth platforms, e-learning tools","this initiative leverages mobile applications and telehealth platforms to facilitate community health education regarding infectious diseases, particularly related to climate impacts, and provides access to medical services in vulnerable neighborhoods."
#TorontoStrong Fund,"online fundraising platforms, data management systems for resource allocation, communication networks","although primarily a fund for recovery, the initiative involves utilizing technology to improve community preparedness and emergency response, thereby increasing community resilience to health crises following extreme events."
University of Toronto School of Cities,"urban simulation models, research databases, public engagement platforms","a research and education hub focused on developing sustainable urban strategies in response to climate challenges, particularly those affecting urban infrastructure and resilience."
Telephone Town Hall Events,"teleconferencing technologies, automated phone systems, call-in platforms","a digital platform for hosting telephone town halls where residents can participate and provide input on resilience strategies, ensuring wider community engagement, especially among those with limited internet access."
Integrated Water Resource Management (IWRM) System,"data integration platforms, analytics, iot sensors, cloud computing","this system integrates data from various sources to optimize water usage in urban areas, addressing increased demand and promoting sustainable practices."
Agincourt Community Services Association resilience initiatives,"emergency preparedness apps, community planning tools","this organization provides resources and training for residents to better prepare for and respond to extreme weather events, with a focus on building community resilience."
Cross-City Learning Platforms,"online forums, knowledge management systems, health data analytics","establishing platforms for cross-city learning allows knowledge sharing on health strategies in response to extreme temperatures, enhancing public health preparedness and response mechanisms."
Public Health Surveillance System,"data analytics, health monitoring systems, gis mapping","an integrated surveillance system collects data on infectious diseases related to climate changes, such as heat stress, to identify emerging health threats and respond effectively with targeted interventions."
Community Water Management System,"sensors, internet of things (iot), data analytics","a smart irrigation and water management system that utilizes sensors to optimize water usage based on real-time data on soil moisture levels, weather forecasts, and plant needs to enhance urban sustainability and reduce water waste."
Public Health Surveillance Systems,"data analytics, health monitoring software, iot sensors","a system that utilizes real-time data collection and analysis to monitor and predict outbreaks of heat-related and vector-borne diseases, enabling health authorities to respond promptly."
Public Health Monitoring Systems,"wearable health sensors, mobile health apps, data analytics platforms, geographic information systems (gis)",utilizing health monitoring systems that track climate-related health risks allows for timely alerts and interventions for vulnerable populations during extreme weather events.
Coastal Resilience Infrastructure,"coastal engineering, environmental modeling software, ecological monitoring systems","innovative coastal resilience infrastructure, such as living shorelines and sea walls, integrates natural and built solutions to protect against coastal flooding and mitigate the impact of sea level rise. this includes enhancing wetlands and barriers that absorb storm surges while also creating habitats for wildlife."
Integrated Urban Water Management Tools,"simulation modeling, data visualization, remote sensing","integrated urban water management tools utilize simulation models to optimize water distribution and usage in urban environments, helping to mitigate water stress and adapt to increased water demand from climate impacts."
Integrated Transportation Systems,"real-time data analytics, gps tracking, mobile applications, machine learning","technologies that promote efficient public transportation through real-time tracking, route optimization, and integrated transport networks. this reduces congestion and enhances mobility during extreme weather events and other crises."
Coastal Resilience Planning Framework,"satellite imagery, predictive modeling, community engagement platforms","a comprehensive framework that integrates satellite imagery, predictive modeling, and community input to assess vulnerabilities and design adaptive strategies to protect coastal infrastructure and ecosystems."
Digital Health Education Programs,"e-learning platforms, webinars, online resource databases","developing online health education programs that provide targeted information to low-income communities can help mitigate health risks and promote preventive care. these programs can include webinars, access to health resources, and connections to local healthcare providers."
Extreme Weather Preparedness and Alert Systems,"weather monitoring systems, push notification technology, data analytics","comprehensive alert systems using real-time weather data can notify residents of extreme weather conditions. these alerts can also provide guidance on how to prepare, reducing the health risks associated with severe temperatures."
Collaborative Citizen Science Projects,"mobile apps, data collection platforms, geospatial mapping tools","citizen science projects that utilize mobile technology can enable residents to collect and share data related to climate impacts, such as flooding or heat island effects. this fosters greater community engagement while providing valuable information to inform local resilience initiatives."
Collaborative Planning Tools,"online collaboration platforms, gis mapping, survey tools","online collaborative planning tools can enable residents to participate in decision-making processes that shape local resilience strategies. these tools facilitate discussions, gather community input, and prioritize local needs effectively."
Job Matching Platform for Sustainable Employment,"online job matching software, machine learning, user databases","a job matching platform that connects local residents with nearby sustainable job opportunities and training programs can help address long commute times and employment disparities, fostering community resilience."
Data-Driven Housing Policy Tools,"data analytics, machine learning, geospatial analysis","utilizing data analytics to inform housing policy can help cities identify trends in housing insecurity and the specific needs of various demographics, particularly indigenous peoples and low-income families. this can help in formulating targeted interventions to improve housing accessibility and affordability."
Virtual Housing Assistance Platforms,"web applications, ai matching algorithms, remote viewing technology","virtual platforms that connect renters and landlords through technology can streamline housing searches and provide access to affordable options. these platforms can incorporate user reviews, virtual tours, and ai to match tenants with suitable housing, reducing overcrowded conditions and promoting greater housing equity."
Community-Based Mobility Solutions,"mobile applications, gps tracking, ride-sharing platforms, data analytics","technology-enabled community-based mobility solutions, such as shared bicycles and ride-sharing programs, can provide equitable access to better transportation options for racialized and newcomer residents. these services can be optimized for safety and efficiency using data-driven platforms."
Improved Urban Green Spaces,"green infrastructure design, environmental sensors, data analytics","developing urban green spaces along transit corridors can help reduce heat stress, improve air quality, and enhance community resilience. green areas can provide shade, promote biodiversity, and encourage walking and biking."
Community Health Mapping,"gis mapping, public health data analytics, mobile applications, community engagement platforms",this community-focused solution uses geographic information systems (gis) to map health impacts related to heat stress in vulnerable populations. it helps public health officials target resources and outreach efforts effectively to mitigate risk among those most affected.
Indigenous Resilience Leadership Program,"knowledge sharing platforms, collaborative mapping tools, community engagement technology","this program supports indigenous leadership in resilience planning, focusing on traditional ecological knowledge to enhance community-level responses to extreme weather events, including flooding and drought management strategies."
Fire Risk Monitoring Systems,"satellite imagery, ai algorithms, data analytics, real-time monitoring systems","systems that utilize satellite imagery and environmental sensors to monitor and predict fire weather conditions, providing early warnings and resource allocation to help communities prepare for potential wildfire outbreaks."
Climate-Resilient Housing Standards,"construction management software, regulatory compliance tools",establishing and enforcing climate-resilient building codes and standards for new housing developments to mitigate risks related to flooding and increased water demand.
Vulnerability Targeting Based on Data Monitoring,"data analytics, geographic information systems (gis), demographic modeling tools","utilizing social vulnerability data to identify and target demographic groups most at risk of flooding, ensuring equitable support for homeowners and renters in vulnerable situations."
Strategic Communications Campaign for Climate Awareness,"social media platforms, email marketing tools, community engagement software, video conferencing tools","a city-led awareness campaign utilizing various communication technologies to inform residents about the risks of extreme weather, flooding, and heat waves, along with actionable adaptation strategies. this may include social media outreach, targeted emails, and community meetings with interactive components."
Retrofit of Greywater Recycling Systems,"greywater filtration and treatment systems, rainwater harvesting systems, and smart water management sensors.","retrofitting apartments with greywater recycling systems can reduce water demand and promote sustainable water use among residents, which can also help alleviate urban flooding by reducing runoff during heavy precipitation."
Collaboration and Partnership Development,"collaborative platforms, project management software, stakeholder engagement tools.",establishing partnerships across governmental levels and organizations in the retrofit space enhances coordination and effectiveness in addressing urban flooding and other water-related challenges. this approach enables resource sharing and leveraging diverse expertise in implementing building resilience tasks.
Advocacy for Enabling Environment,"policy frameworks, collaboration platforms, funding and financing models for retrofits",advocating for regulatory changes at federal and provincial levels will create a supportive environment that encourages resilience upgrades in buildings to better withstand extreme weather and manage flooding risks.
Efficient Plumbing Fixtures and Smart Lighting,"water-saving fixtures, smart lighting technology, sensors","the installation of efficient toilets, showerheads, and faucets reduces water consumption and lowers utility costs. in conjunction with smart lighting systems that include light sensors, these upgrades enhance overall resource efficiency within the community housing, making the buildings more resilient to climate impacts."
Climate-Responsive Zoning Regulations,"geographic information system (gis) technology, urban planning software",update zoning regulations to include climate-responsive guidelines that prevent new housing developments in flood-prone areas and encourage retrofitting existing buildings for flood resilience.
Infrastructure Resilience Assessment Tools,"geographic information systems (gis), simulation software, big data analytics",using advanced simulation and modeling tools to assess the resilience of existing infrastructure against geological hazards such as mass movement and fire weather ensures proactive maintenance and upgrades to reduce risk.
Neighborhood Emergency Preparedness Apps,"mobile app development, cloud computing, push notification systems, community forums","mobile applications specifically designed for neighborhoods that provide tailored emergency preparedness guidelines, local alerts, and resources for specific types of shocks like floods or storms. these apps encourage community participation in preparedness drills and share local resilience strategies."
Digital Emergency Preparedness Toolkits,"web applications, e-learning platforms, interactive documents","creation of digital toolkits that provide resources on emergency preparedness, safety tips, and recovery resources tailored for communities historically underinvested in resilience planning, improving overall community readiness to respond to extreme weather events."
Emergency Communication System,"sms alert systems, mobile applications, social media integration","a robust emergency communication system designed to send timely alerts and updates to residents regarding weather conditions, safety tips, and available resources during extreme winter weather events."
Emergency Preparedness Plans,"planning software, incident response applications, geographic information systems (gis)","tailored emergency preparedness plans for neighbourhoods that are most at risk, focusing on their respective challenges and resources. these plans facilitate coordinated responses to climate-related incidents, ensuring that all community members, especially vulnerable populations, are equipped to handle emergencies effectively."
Flood Early Warning System,"iot sensors, machine learning algorithms, cloud computing","this system utilizes meteorological data, hydrological models, and iot sensors to provide real-time alerts for potential flooding events. it helps communities prepare and respond effectively to flooding by disseminating warnings through various communication channels."
Sustainable Mobility Solutions,"electric vehicles, gis routing software, mobility-as-a-service platforms","implementing sustainable transportation options, such as electric buses and bike-sharing programs, enhances urban mobility while reducing the vulnerability of transport systems to flooding and storm damage. such solutions integrate with urban planning to ensure access during extreme weather events."
Economic Empowerment through Job Matching Platforms,"online job portals, ai algorithms, data analytics, mobile applications","creating technology-enabled job matching platforms that connect low-income residents with stable job opportunities, training programs, and resources that emphasize resilience in the workforce against climate impacts. this can improve economic stability and enhance community resilience."
Fire Risk Monitoring Systems,"satellite imagery, weather sensors, machine learning for risk prediction, and data analytics platforms.","utilizing real-time data from weather stations and satellite imagery, these systems assess and predict wildfire risk, allowing for proactive management strategies and community awareness to reduce fire hazards."
Community-Based Flood Resilience Plans,"community mapping tools, online survey platforms, collaborative planning software",developing community-based resilience plans involving local stakeholders enhances understanding and capacity to respond to flooding risks at the neighborhood level. this participatory approach ensures tailored solutions factoring in community vulnerabilities and assets.
Public Engagement and Communication Program,"social media, community engagement platforms, educational outreach resources","a program that seeks to effectively communicate flood risks to residents and businesses, providing resources and guidance for taking proactive measures towards flood resilience."
Snow and Ice Monitoring Systems,"remote sensing, data analytics, weather forecasting tools","snow and ice monitoring systems use sensors and weather data to track snowfall and ice accumulation in real-time. this technology provides municipalities with the information needed to deploy snow removal and ice management efforts efficiently, reducing hazards for transportation and public safety."
Port Lands Flood Protection Project,"flood control infrastructure, stormwater management systems, habitat restoration technologies, urban planning software.","the port lands flood protection project is designed to protect approximately 290 hectares of land from flooding, particularly during extreme weather events like those similar to hurricane hazel. the project includes creating a naturalized mouth of the don river and a mixed-use community on villiers island, enhancing resilience against coastal flooding while promoting natural habitats."
