Solution Name,Technologies,Description
City-Wide Urban Flooding Risk Mapping Tool,"geographic information systems (gis), data centralization platforms, risk assessment tools, cloud computing, public information systems","this tool will centralize existing data to create a comprehensive map of urban flooding risks across the city. it will synthesize topographical data, sewer capacity, and overlay critical infrastructure vulnerabilities. the tool aims to facilitate planning and prioritization for emergency management, utility operations, and provide the public with necessary flood risk information."
Public Awareness and Education Platform,"e-learning platforms, mobile applications, data visualization, social media tools",a companion platform to the flood mapping tool designed to educate the public about flood risks and resilience strategies. this platform will leverage the flood mapping data to inform and engage communities on how to prepare for and respond to urban flooding events.
Smart Stormwater Infrastructure,"smart valves, real-time weather data integration, automated control systems",upgrading stormwater facilities with smart technology allows for real-time adjustments based on weather conditions. this can involve automated gates and valves that respond to rainfall data to manage water flow and mitigate flooding risks effectively.
Collaborative Operational Framework,"project management software, collaborative platforms, communication tools","developing a framework that standardizes protocols for multiple departments and agencies involved in flood management, enhancing coordination and operational efficiency in preparation for extreme weather events."
Integrated Flood Risk Assessment Model,"predictive modeling software, data analysis tools, geographic information systems (gis)","developing an integrated model that assesses flood risks using data from multiple sources, such as weather patterns, land use, and historical flooding data, allows for a comprehensive understanding of vulnerabilities and aids in planning effective flood mitigation strategies."
Public Awareness and Education Campaign,"social media platforms, online educational tools, mobile applications, community engagement software.","a campaign utilizing digital platforms to educate residents about the risks of extreme heat and prevention strategies, including heat safety tips and information about local cooling resources."
Heat Preparedness Training,"e-learning platforms, online training modules, mobile apps for preparedness tips",a training initiative aimed at equipping community members with knowledge and skills to prepare for and respond to heatwaves effectively. this program includes educating residents on symptoms of heat stress and mitigation strategies.
Community Engagement Platforms for Green Initiatives,"social media, community engagement apps, data visualization tools","this solution involves the development of technology-enabled platforms that facilitate communication and engagement with community members about ongoing resilience projects, gathering input on local needs, and fostering involvement in green infrastructure initiatives."
Monitoring and Evaluation System,"remote sensing, data analytics, environmental monitoring sensors","developing a monitoring and evaluation system for green and blue infrastructure to track performance against climate adaptation goals, ensuring that projects provide measurable benefits such as reduced flooding and improved water quality."
Urban Tree Canopy Programs,"urban forestry management software, gis mapping, tree planting and care technologies","urban tree canopy programs promote planting and maintaining trees in urban areas to provide shade, mitigate heat, and improve air quality. trees help lower surface temperatures and reduce the need for air conditioning, enhancing community resilience to extreme heat events."
Localized Food Waste Reduction Initiatives,"mobile apps for food sharing, composting technology, waste tracking systems","establishing localized initiatives that focus on reducing food waste through composting programs, surplus food redistribution technology, and food-sharing applications can improve food system resilience while decreasing pressure on water resources and promoting sustainable community practices."
Emergency Food Access Dashboard,"web development, data visualization, mobile applications","an interactive dashboard that provides real-time information on food availability and access points in case of adverse weather events, tailored for seniors and vulnerable populations."
Resilience-Focused Asset Management Software,"asset management software, climate risk assessment tools, data visualization tools","software tools specifically designed to help municipalities manage and maintain infrastructure assets with a focus on resilience to climate change impacts, allowing for informed investment and maintenance decisions based on projected climate scenarios."
Integrated Climate Risk Assessment Tools,"risk assessment software, predictive analytics, remote sensing technology","these tools evaluate the comprehensive range of climate challenges, including extreme heat, flooding, and severe storms, that cities might face. by providing data-driven insights, they inform decision-makers on adapting existing infrastructure or designing new projects that address those risks effectively."
Capacity Building Workshops,"e-learning platforms, virtual training software, collaborative tools","conducting workshops and training sessions helps city staff understand how to apply resilience principles and utilize the resilience lens in their work, ultimately improving the city’s ability to withstand climate impacts through informed decision-making."
Metrolinx Climate Adaptation Strategy,"climate modeling, infrastructure assessment tools, resilience planning frameworks","the climate adaptation strategy outlines actions to make the transit system safe and resilient against climate impacts, focusing on operations, asset management, and project planning to ensure reliability during extreme weather events."
Conservation Authority Initiatives,"flood modeling tools, real-time monitoring systems, watershed management systems","through coordinated flood control and water management practices, the conservation authority collaborates with municipalities to implement measures that manage water flow and mitigate the risks associated with flooding events."
Public Awareness Campaigns on Climate Resilience,"social media platforms, mobile applications, interactive websites","developing campaigns to educate the public on the importance of climate resilience and encourage community involvement in maintaining urban green spaces, contributing to the overall climate adaptation strategy."
Energy-Efficient Building Design,"high-performance insulation, energy-efficient hvac systems, smart building technologies","the emphasis on near-zero emissions development through energy-efficient designs in buildings minimizes electricity demand, making them more resilient to climate extremes while also contributing to the city's energy and emission targets."
Collaborative Resilience Planning Platform,"cloud computing, collaboration software, data-sharing protocols.","a digital platform facilitating collaboration among different city departments and stakeholders, enabling them to share data and best practices on resilience planning and asset management. this approach ensures a comprehensive and unified response to climate adaptation needs."
Disaster Recovery Planning Software,"project management software, data analytics, cloud computing","this software assists municipalities in creating and updating disaster recovery plans in response to climate change impacts. it includes modules for resource allocation, recovery strategies, and funding management, ensuring that the community is prepared for extreme weather events and can respond efficiently."
Green Infrastructure for Mobility Support,"green infrastructure techniques, environmental sensors, urban planning software","implementing green infrastructure, such as permeable pavements and green roofs, in areas surrounding transit routes can help manage stormwater, reduce urban flooding, and improve the overall resilience of transportation infrastructure."
Community-Based Crowdsourcing Platforms,"online surveys, mobile apps, social media engagement, data aggregation tools.","community-based crowdsourcing platforms enable residents to provide feedback, report mobility issues, and suggest improvements tailored to their needs. engaging low-income communities in the planning process promotes more resilient mobility solutions that account for local vulnerabilities and enhances adaptive capacities during extreme weather events."
Automated Vehicle Integration,"vehicle automation technology, ai, advanced sensor systems",preparing infrastructure for automated vehicles can enhance the resilience of transportation networks by ensuring they can adapt to changing conditions and remain operational during extreme weather events.
Congestion Management Plan,"traffic management software, real-time analytics, iot sensors","the congestion management plan employs innovative technologies to enhance traffic flow and mitigate congestion during extreme weather conditions, helping to prevent further water accumulation and flooding in urban areas."
Sustainable Funding Model,"financial modeling software, public policy advocacy platforms, governmental budgeting systems","advocating for a sustainable funding model allows for fiscal incentives that can be reinvested into the transit system to improve infrastructure that is resilient against impacts from extreme weather, such as flood-resistant transit stations and drainage improvements."
Development of a 10-Year Transit Outlook,"urban planning software, stakeholder engagement platforms, simulation modeling tools","a strategic vision plan that outlines actionable transit improvements, enhancing mobility in toronto while addressing climate adaptation needs and aligning with environmental goals, through comprehensive assessments and stakeholder involvement."
Community Mobility Studies,"geographic information system (gis) mapping, data collection and analytics platforms, mobile survey tools.",conducting mobility studies to identify low-income communities and their transportation needs ensures that any infrastructure improvements not only enhance mobility but also promote equitable access to transit both in normal conditions and emergencies caused by climate extremes.
Climate-Resilient Urban Design,"rainwater harvesting systems, smart irrigation technology, urban planning software, green infrastructure design tools","integrating climate-resilient urban design principles that incorporate efficient water use and management can help mitigate the impacts of heat stress in suburban areas. this includes green spaces, rainwater harvesting systems, and xeriscaping, which can reduce the demand for potable water during extreme heat events, enhancing community resilience."
Urban Green Infrastructure Planning Tool,"simulation software, gis, data analytics",a planning tool that helps municipalities design urban green spaces and permeable surfaces to manage stormwater runoff effectively. it uses simulations to visualize the impacts of different green infrastructure designs on erosion and flooding.
Community Feedback Apps,"mobile applications, survey tools, data visualization software","community feedback apps can allow residents to report issues, participate in surveys, and give feedback on local policies and initiatives in real time. this can empower citizens and create a sense of ownership over civic issues, thereby increasing trust in local government and encouraging more active participation."
Collaborative Urban Planning App,"collaborative software, geospatial analysis tools, community feedback systems","an app that allows community members to collaborate with city planners on urban resilience initiatives. users can submit suggestions, report local climate impacts, and view proposed plans in real-time, which fosters inclusivity and ensures diverse perspectives are considered in urban development and adaptation efforts."
Feedback Management Systems,"crm systems, feedback apps, data sharing platforms.",implementing integrated feedback management systems allows for more seamless communication and data sharing on public inputs. this transparency can help address community concerns related to climate issues like flooding and water access.
Early Warning Systems for Extreme Weather,"iot sensors, data modeling software, mobile alerting systems","deploying an early warning system that uses iot technology to gather and analyze meteorological data can provide timely alerts to residents about impending extreme weather events, helping them to prepare and respond appropriately."
Mobile Communication Solutions,"mobile applications, sms alert systems, gis mapping","developing mobile-based solutions that provide real-time updates and alerts about weather events, flooding, and emergency resources, ensuring that information reaches all sections of the community effectively."
Flood Simulation Modeling Software,"geographic information systems (gis), hydrological modeling tools, simulation software","this software tool uses geographical and meteorological data to simulate potential flooding under various climate scenarios. this allows city planners to visualize the impacts of extreme weather events, leading to better urban design and infrastructure planning for flood resilience."
Digital Training Programs,"e-learning platforms, video tutorials, mobile applications",digital platforms offering training and educational resources designed to equip vulnerable communities with skills and knowledge to prepare for and respond to wildfire risks. inclusion of diverse languages and cultural context ensures accessibility for marginalized groups.
Stakeholder Dialogue Platforms,"online collaboration tools, social media analytics, cloud-based communication platforms","leveraging equity data, the city can create online platforms to facilitate dialogue among stakeholders, including marginalized groups. these platforms will allow community members to express their needs and priorities, ensuring that their voices are heard in climate adaptation strategies."
Just Transition Initiatives,"job training platforms, economic modeling software, workforce development technology","initiatives aimed at creating and maintaining good quality local jobs while preparing communities for economic disruption caused by extreme weather events, thereby enhancing economic resilience."
Telehealth Services for Climate-Related Health Risks,"telemedicine platforms, mobile health applications, health information systems","utilizing telehealth technology to provide remote healthcare services can help indigenous communities address health risks associated with climate change, such as heat stress and the spread of infectious diseases, through early detection, education, and access to medical resources."
Knowledge Sharing Networks,"online forums, mobile knowledge-sharing apps, cloud-based storage and collaboration tools","establishing technology-based networks to share indigenous knowledge and best practices related to climate adaptation and resilience, allowing for knowledge transfer across communities and the incorporation of traditional practices into urban climate strategies."
Environmental Monitoring Drones,"drones, machine learning algorithms, geographic information systems (gis)",use of drone technology to monitor land and vegetation conditions in urban and peri-urban areas for early detection of wildfire risks and other geological hazards. data from drones can be integrated into community preparedness plans developed with indigenous knowledge insight.
Resilient Infrastructure Rating System,"data analytics, assessment tools, simulation software","establishing a rating system that evaluates the resilience of infrastructure projects based on their capacity to withstand extreme weather events, guiding investments and prioritization of upgrades."
Innovative Financing Mechanisms,"financial modeling software, crowdfunding platforms, economic analysis tools","developing business cases and exploring creative funding options, such as public-private partnerships and grants, to secure financial resources for the implementation of the resilience strategy and resilience-building projects."
Climate Resilient Agriculture Technologies,"genetic engineering, precision agriculture tools, soil moisture sensors",climate resilient agriculture technologies include drought-resistant crop varieties and precision irrigation systems that optimize water use and maintain crop yields despite periods of low water availability.
Wildfire Risk Management Systems,"satellite imagery, machine learning, data visualization tools","wildfire risk management systems leverage predictive analytics and remote sensing data to assess fire risk, monitor conditions, and implement proactive measures for fire management and community preparedness."
Community Engagement and Training Programs,"online learning platforms, mobile applications, social media analytics","technology-driven platforms facilitate community engagement regarding climate adaptation strategies, providing training and resources for residents to build local resilience to various climate challenges."
Hazard Identification and Risk Assessment process enhancements,"risk assessment software, geographic information systems (gis), predictive analytics tools","this process identifies potential hazards affecting the city and assesses their risks, integrating data-driven insights to enhance emergency preparedness and response capabilities. it supports informed decision-making and planning for resilience against climate threats."
Social Vulnerability Mapping Tool,"geographic information systems (gis), spatial analysis, data integration techniques, public data platforms",a mapping tool that overlays social vulnerability data with climate risk assessments to identify which communities are most at risk during extreme weather events. this tool can help prioritize outreach and support efforts to improve community resilience.
Integrated Community Leadership,"collaboration platforms, social media engagement tools, project management software","a strategy focused on galvanizing leadership among collaboration between academia, industry, and community partners to implement and enhance resilience measures across various sectors responding to climate challenges."
Resilience Office,"project management tools, stakeholder engagement platforms, monitoring and evaluation software","the resilience office serves as a central hub to coordinate efforts across multiple stakeholders, ensuring that resilience strategies are effectively implemented, monitored, and adapted to current and future climate challenges."
Emergency Command Centers,"communication technology, emergency management systems, energy generation and storage solutions","the ymca centres will serve as command centers for first responders, providing a coordinated effort for managing emergencies, ensuring safety, and responsive services for affected communities."
Hosting Global Resilience Events,"event management software, streaming technologies, networking platforms","by hosting international conferences and events focused on resilience, toronto can elevate its profile as a leader in climate adaptation, attract global expertise, and promote collaborative projects that address various climate challenges."
Sustainable Resource Procurement,"e-procurement platforms, supply chain management tools, sustainable resource databases","utilizing the city’s purchasing power for sustainable resource procurement can support local industries focused on renewable and reclaimed materials, thus ensuring resource availability while reducing reliance on water-intensive extraction processes."
Sustainable and Resilient Food Systems,"hydroponics systems, aquaponics technologies, water management systems",creating urban agriculture initiatives that use hydroponics and aquaponics to produce food locally while managing water use efficiently and mitigating flooding through permeable landscapes.
Fire Weather Monitoring and Alert System,"meteorological sensors, predictive analytics, emergency notification systems",an advanced monitoring system that predicts fire weather conditions using atmospheric data and provides alerts to residents and emergency services to prepare for potential wildfires.
Water Demand Forecasting System,"data analytics, forecasting algorithms, machine learning, cloud computing","a predictive modeling tool that analyzes historical consumption data, seasonal trends, and climate variables to forecast future water demand, enabling better resource allocation and sustainable water management."
